{
  "schema_version": "1.0",
  "transition_id": "PROJECT-LEADER-POSTSYNC-ALIGNMENT-HYGIENE-103-PURGE-083",
  "task_id": "PROJECT-LEADER-POSTSYNC-ALIGNMENT-HYGIENE-103",
  "repository": "martaxi-boss/Project-leader",
  "created_at": "2026-10-09T18:18:56.012Z",
  "action": "delete_owner_authorized_superseded_non_main_branch_refs",
  "effect_class": "E3_DESTRUCTIVE_EXTERNAL_PRIVILEGED",
  "authority": {
    "source": "CURRENT_OWNER_INSTRUCTION",
    "summary": "Owner requested old-version/residue hygiene. Supervisor confirmed exact branch 'builder/proprietary-license-083' is a closed or abandoned non-main candidate at d73647599066468dadca98b29e0792a42e3f76c6, superseded by already-merged PR #89; its active functionality is in protected main. Only delete this exact ref after live no-open-PR and lease verification; preserve audit history, required control evidence, unrelated refs and any branch that has advanced.",
    "binding_mode": "EXACT_REVISION_BOUND"
  },
  "target": {
    "kind": "repository_branch",
    "identifier": "builder/proprietary-license-083",
    "revision": "d73647599066468dadca98b29e0792a42e3f76c6",
    "base_revision": "ce0b0510897dce25787ccbe058977b60737f8ae2",
    "environment": null
  }
}
