{
  "schema_version": "1.0",
  "transition_id": "PROJECT-LEADER-CANONICAL-RUNTIME-BOOTSTRAP-056R-MERGE",
  "task_id": "PROJECT-LEADER-CANONICAL-RUNTIME-BOOTSTRAP-056R",
  "repository": "martaxi-boss/Project-leader",
  "created_at": "2026-10-04T12:26:00Z",
  "action": "merge_to_main",
  "effect_class": "E2_CONSEQUENTIAL_TRANSITION",
  "authority": {
    "source": "STANDING_OWNER_GRANT",
    "summary": "Owner explicitly requested the Project Leader runtime/bootstrap correction and standing authority covers validated consequential transitions. Supervisor revalidated PR #57 at exact head 6492e35ca616d561474239c1eedb4730cc3203bf on exact main base a2f7d8e207b979095f1866d9c526002cf5b98b6a. Implementation head 19a34788200c12442d7acc02c62c710f69cef9e9 passed all required CI; final head differs only by task-local Worker Result and trust-root result evidence and itself passed Trusted authorization gate, Control contract tests, Validate control plane and Package ChatGPT plugins.",
    "binding_mode": "EXACT_REVISION_BOUND"
  },
  "target": {
    "kind": "pull_request",
    "identifier": "#57",
    "revision": "6492e35ca616d561474239c1eedb4730cc3203bf",
    "base_revision": "a2f7d8e207b979095f1866d9c526002cf5b98b6a",
    "environment": null
  }
}
