{
  "schema_version": "1.0",
  "transition_id": "PROJECT-LEADER-PLUGIN-VERSION-CLARITY-HYGIENE-046-TRUST-ROOT",
  "task_id": "PROJECT-LEADER-PLUGIN-VERSION-CLARITY-HYGIENE-046",
  "repository": "martaxi-boss/Project-leader",
  "created_at": "2026-10-04T02:29:30Z",
  "action": "trust_root_mutation",
  "effect_class": "E3_DESTRUCTIVE_EXTERNAL_PRIVILEGED",
  "authority": {
    "source": "CURRENT_OWNER_INSTRUCTION",
    "summary": "Owner authorized correction and hygiene. PR #45 exposed that version validation workflow pins must move with package identity. This exact transition authorizes only the bounded 0.6.1/0.5.1 package identity and corresponding validation assertion changes in task 046, with no skill/runtime behavior change.",
    "binding_mode": "EXACT_REVISION_BOUND"
  },
  "target": {
    "kind": "repository_branch",
    "identifier": "builder/plugin-version-clarity-046",
    "revision": "3aa59b1e2b1452371fb0040df56e46cda7479dbd",
    "base_revision": "7dc5aa8cb86ed0a473c5e95fab4cd40f6eab7875",
    "environment": null
  }
}
