{
  "schema_version": "1.0",
  "transition_id": "PROJECT-LEADER-AUDIT-POLICY-DOC-SCOPE-076-TRUST-ROOT",
  "task_id": "PROJECT-LEADER-AUDIT-POLICY-DOC-SCOPE-076",
  "repository": "martaxi-boss/Project-leader",
  "created_at": "2026-10-07T10:03:20Z",
  "action": "trust_root_mutation",
  "effect_class": "E3_DESTRUCTIVE_EXTERNAL_PRIVILEGED",
  "authority": {
    "source": "CURRENT_OWNER_INSTRUCTION",
    "summary": "Task 075 was rejected because three audit-required documentation paths were outside the immutable base policy ceiling. This exact transition authorizes only the minimal Project Leader policy edit required to admit CHANGELOG.md and SOURCES.md as documentation and SECURITY.md as protected E3 governance content.",
    "binding_mode": "EXACT_REVISION_BOUND"
  },
  "target": {
    "kind": "repository_branch",
    "identifier": "builder/audit-policy-doc-scope-076",
    "revision": "a049170c8a3bb0cb6d87090b2ac6b4288fe51661",
    "base_revision": "7a4684ca7a2ff83529a75f040ce3bc2be3040b8a",
    "environment": null
  }
}
