{
  "schema_version": "1.0",
  "transition_id": "PROJECT-LEADER-AUDIT-REMEDIATION-P2-079-TRUST-ROOT",
  "task_id": "PROJECT-LEADER-AUDIT-REMEDIATION-P2-079",
  "repository": "martaxi-boss/Project-leader",
  "created_at": "2026-10-07T10:24:00Z",
  "action": "trust_root_mutation",
  "effect_class": "E3_DESTRUCTIVE_EXTERNAL_PRIVILEGED",
  "authority": {
    "source": "STANDING_OWNER_GRANT",
    "summary": "Exact trust-root authorization for the bounded P2 R10-R12 audit remediation under immutable Task Authorization e22468e013f8adb37899091a767f78ec2f6ac4bc. No external project, license, repository-admin event policy, release/deploy, architecture or role-hierarchy mutation is authorized.",
    "binding_mode": "EXACT_REVISION_BOUND"
  },
  "target": {
    "kind": "repository_branch",
    "identifier": "builder/audit-remediation-p2-079",
    "revision": "e22468e013f8adb37899091a767f78ec2f6ac4bc",
    "base_revision": "1fa8ace2627bedf5d9aa77f8525de9bc76d25204",
    "environment": null
  }
}
