{
  "schema_version": "1.0",
  "transition_id": "PROJECT-LEADER-HYGIENE-CLOSEOUT-037-TRUST-ROOT",
  "task_id": "PROJECT-LEADER-HYGIENE-CLOSEOUT-037",
  "repository": "martaxi-boss/Project-leader",
  "created_at": "2026-10-03T18:27:20Z",
  "action": "trust_root_mutation",
  "effect_class": "E3_DESTRUCTIVE_EXTERNAL_PRIVILEGED",
  "authority": {
    "source": "CURRENT_OWNER_INSTRUCTION",
    "summary": "Owner authorized Project Leader hygiene, exact audited obsolete branch removal and preservation of useful audit evidence. Canonical policy now permits the bounded README/PLUGIN_SETUP closeout.",
    "binding_mode": "EXACT_REVISION_BOUND"
  },
  "target": {
    "kind": "repository_branch",
    "identifier": "builder/hygiene-closeout-037",
    "revision": "8f4b9f8d3025725ea27efbee7064d0e2815deb83",
    "base_revision": "b9aab120e59fabeacab775612c5065c6eedc9f63",
    "environment": null
  }
}
