{
  "schema_version": "1.0",
  "transition_id": "PROJECT-LEADER-STALE-BASE-STATUS-FIX-092-BRANCH-PURGE",
  "task_id": "PROJECT-LEADER-STALE-BASE-EVENT-ISOLATION-093",
  "repository": "martaxi-boss/Project-leader",
  "created_at": "2026-10-07T15:50:00Z",
  "action": "delete_owner_authorized_superseded_non_main_branch_refs",
  "effect_class": "E3_DESTRUCTIVE_EXTERNAL_PRIVILEGED",
  "authority": {
    "source": "CURRENT_OWNER_INSTRUCTION",
    "summary": "Task 092 is merged and its remaining evidence-only branch is obsolete. Delete it only if the live SHA still matches exactly and no open PR uses it.",
    "binding_mode": "EXACT_REVISION_BOUND"
  },
  "target": {
    "kind": "repository_branch",
    "identifier": "builder/stale-base-status-fix-092",
    "revision": "2d1e591356ab53d49b65eedfff30bece91b4ae65",
    "base_revision": "9a2ca8e6fb47fe7341d15c2ed4b580cd517af22b",
    "environment": null
  }
}
