{
  "schema_version": "1.0",
  "transition_id": "PROJECT-LEADER-LICENSE-POLICY-082-TRUST-ROOT",
  "task_id": "PROJECT-LEADER-LICENSE-POLICY-082",
  "repository": "martaxi-boss/Project-leader",
  "created_at": "2026-10-07T10:56:00Z",
  "action": "trust_root_mutation",
  "effect_class": "E3_DESTRUCTIVE_EXTERNAL_PRIVILEGED",
  "authority": {
    "source": "STANDING_OWNER_GRANT",
    "summary": "Exact trust-root authorization for the bounded policy precursor that admits only the exact LICENSE path and license_selection transition required by the Owner's explicit proprietary-license decision. No license text is created by this transition.",
    "binding_mode": "EXACT_REVISION_BOUND"
  },
  "target": {
    "kind": "repository_branch",
    "identifier": "builder/license-policy-082",
    "revision": "6f80388b84c4d0375bc9bd80244d25cc63549536",
    "base_revision": "519f132f74955f7d7f148b1564ae0a95d158c795",
    "environment": null
  }
}
