{
  "schema_version": "1.0",
  "transition_id": "PROJECT-LEADER-HUMAN-GATE-BASE-TARGET-011-TRUST-ROOT",
  "task_id": "PROJECT-LEADER-HUMAN-GATE-BASE-TARGET-011",
  "repository": "martaxi-boss/Project-leader",
  "created_at": "2026-10-03T07:47:00Z",
  "action": "trust_root_mutation",
  "effect_class": "E3_DESTRUCTIVE_EXTERNAL_PRIVILEGED",
  "authority": {
    "source": "CURRENT_OWNER_INSTRUCTION",
    "summary": "Owner explicitly authorizes only the Project Leader trust-root correction that prevents development-branch merges from being misclassified as merge-to-main Human Gates.",
    "binding_mode": "EXACT_REVISION_BOUND"
  },
  "target": {
    "kind": "repository_branch",
    "identifier": "builder/human-gate-base-target-fix-011",
    "revision": "1b42d7bf5f05856207e05fdbe8d9400e1b63575f",
    "base_revision": "a8eeff8f25ef9f632ed2542c167b2137a439f705",
    "environment": null
  }
}
