{
  "schema_version": "1.0",
  "transition_id": "PROJECT-LEADER-LIVENESS-HYGIENE-041-MERGE-002",
  "task_id": "PROJECT-LEADER-LIVENESS-HYGIENE-041",
  "repository": "martaxi-boss/Project-leader",
  "created_at": "2026-10-03T22:59:30.907Z",
  "action": "merge_to_main",
  "effect_class": "E2_CONSEQUENTIAL_TRANSITION",
  "authority": {
    "source": "STANDING_OWNER_GRANT",
    "summary": "Owner explicitly ordered immediate Project Leader liveness correction and complete same-repository hygiene. PR #41 head 43139f69d96b4318a936e2549f4e1ca9f142d8ba contains the CI-certified implementation plus evidence-only correction of the Worker Result authorization digest. Control contract, validation, package and trusted-authorization checks are all successful. No external project, deploy, release, secret, paid-service or branch-protection effect is included.",
    "binding_mode": "EXACT_REVISION_BOUND"
  },
  "target": {
    "kind": "pull_request",
    "identifier": "#41",
    "revision": "43139f69d96b4318a936e2549f4e1ca9f142d8ba",
    "base_revision": "66db27d8118cfa527a21466b8a5034acd5b4395e",
    "environment": null
  }
}
