{
  "schema_version": "1.0",
  "transition_id": "PROJECT-LEADER-DEVELOPMENT-MERGE-AUTHORITY-020-MERGE",
  "task_id": "PROJECT-LEADER-DEVELOPMENT-MERGE-AUTHORITY-020",
  "repository": "martaxi-boss/Project-leader",
  "created_at": "2026-10-03T12:09:51.069Z",
  "action": "merge_to_main",
  "effect_class": "E2_CONSEQUENTIAL_TRANSITION",
  "authority": {
    "source": "CURRENT_OWNER_INSTRUCTION",
    "summary": "Owner explicitly authorized advancing with all mapped Project Leader remediations, including merges to main, watchdog closure, cleanup, and final audit. This record authorizes merge of certified PR #20 only.",
    "binding_mode": "EXACT_REVISION_BOUND"
  },
  "target": {
    "kind": "pull_request",
    "identifier": "#20",
    "revision": "f10673d868f8f1a4b28c3e88b280624a16491513",
    "base_revision": "6b95a0316dd5a03610d864d8b9369e41422057cb",
    "environment": null
  }
}
