{
  "schema_version": "1.0",
  "transition_id": "PROJECT-LEADER-RECOVERY-COMPACTION-HYGIENE-066-DELETE-01",
  "task_id": "PROJECT-LEADER-RECOVERY-COMPACTION-HYGIENE-066",
  "repository": "martaxi-boss/Project-leader",
  "created_at": "2026-10-05T17:59:00Z",
  "action": "delete_owner_authorized_superseded_non_main_branch_refs",
  "effect_class": "E3_DESTRUCTIVE_EXTERNAL_PRIVILEGED",
  "authority": {
    "source": "CURRENT_OWNER_INSTRUCTION",
    "summary": "Owner requested continuous Project Leader hygiene. Delete only exact obsolete ref builder/recovery-compaction-063 at d3656ecfda8632846bc54fa93cfb9484052d6bf2; superseded failed Task 063 attempt; final corrected implementation is canonical through Task 065. If the live ref SHA differs, preserve it.",
    "binding_mode": "EXACT_REVISION_BOUND"
  },
  "target": {
    "kind": "repository_branch",
    "identifier": "builder/recovery-compaction-063",
    "revision": "d3656ecfda8632846bc54fa93cfb9484052d6bf2",
    "base_revision": "d64b4a8d0f5d11621b691b79da18123bbbc3a9d3",
    "environment": null
  }
}
