{
  "schema_version": "1.0",
  "transition_id": "PROJECT-LEADER-POLICY-MAINTENANCE-DOCS-076-TRUST-ROOT",
  "task_id": "PROJECT-LEADER-POLICY-MAINTENANCE-DOCS-076",
  "repository": "martaxi-boss/Project-leader",
  "created_at": "2026-10-07T10:06:00Z",
  "action": "trust_root_mutation",
  "effect_class": "E3_DESTRUCTIVE_EXTERNAL_PRIVILEGED",
  "authority": {
    "source": "STANDING_OWNER_GRANT",
    "summary": "Exact trust-root authorization for the bounded Recovery replan that adds only CHANGELOG.md, SECURITY.md and SOURCES.md to the Project Leader maintenance-document policy ceiling under immutable Task Authorization 7f2988ca5ccb069dd9a81a8792a5c082eb1e3c45.",
    "binding_mode": "EXACT_REVISION_BOUND"
  },
  "target": {
    "kind": "repository_branch",
    "identifier": "builder/policy-maintenance-docs-076",
    "revision": "7f2988ca5ccb069dd9a81a8792a5c082eb1e3c45",
    "base_revision": "7a4684ca7a2ff83529a75f040ce3bc2be3040b8a",
    "environment": null
  }
}
