{
  "schema_version": "1.0",
  "transition_id": "PROJECT-LEADER-AUTONOMY-033-TRUST-ROOT",
  "task_id": "PROJECT-LEADER-AUTONOMY-033",
  "repository": "martaxi-boss/Project-leader",
  "created_at": "2026-10-03T17:06:00Z",
  "action": "trust_root_mutation",
  "effect_class": "E3_DESTRUCTIVE_EXTERNAL_PRIVILEGED",
  "authority": {
    "source": "CURRENT_OWNER_INSTRUCTION",
    "summary": "Owner explicitly authorized correcting Project Leader's own Human Gate and Recovery autonomy semantics, phased and isolated from PINK IPTV, FADEGO, VCAM-PRO and all other project-specific policies/repositories.",
    "binding_mode": "EXACT_REVISION_BOUND"
  },
  "target": {
    "kind": "repository_branch",
    "identifier": "builder/project-leader-autonomy-033",
    "revision": "0d0641b85132b87b59adb65f13f6f62e921a6d22",
    "base_revision": "73c5512674b2f14d82d69f6f4a10a8f886cf0049",
    "environment": null
  }
}
