{
  "schema_version": "1.0",
  "transition_id": "PROJECT-LEADER-SAME-SHA-PAGINATION-040-TRUST-ROOT",
  "task_id": "PROJECT-LEADER-SAME-SHA-PAGINATION-040",
  "repository": "martaxi-boss/Project-leader",
  "created_at": "2026-10-03T19:37:00Z",
  "action": "trust_root_mutation",
  "effect_class": "E3_DESTRUCTIVE_EXTERNAL_PRIVILEGED",
  "authority": {
    "source": "CURRENT_OWNER_INSTRUCTION",
    "summary": "Owner authorized the third isolated external-audit hardening correction: paginate same-SHA GitHub Actions workflow runs beyond the first 100 and fail closed when complete stable evidence cannot be proven, without changing architecture or unrelated runtime behavior.",
    "binding_mode": "EXACT_REVISION_BOUND"
  },
  "target": {
    "kind": "repository_branch",
    "identifier": "builder/same-sha-pagination-040",
    "revision": "2fd6b81f2bfbf6a54fe251c6dbe950256a0ccee9",
    "base_revision": "71ebe51c7cba90b7caf5b4279d40ff0a7e3375d3",
    "environment": null
  }
}
