{
  "schema_version": "1.0",
  "transition_id": "PROJECT-LEADER-AUDIT-REMEDIATION-P2-079-MERGE-83",
  "task_id": "PROJECT-LEADER-AUDIT-REMEDIATION-P2-079",
  "repository": "martaxi-boss/Project-leader",
  "created_at": "2026-10-07T10:39:00Z",
  "action": "merge_to_main",
  "effect_class": "E2_CONSEQUENTIAL_TRANSITION",
  "authority": {
    "source": "STANDING_OWNER_GRANT",
    "summary": "Canonical Project Leader standing authority covers integration of the bounded P2 R10-R12 audit remediation after exact-head Supervisor audit. PR 83 is open, non-draft and mergeable at exact head 5e2d6a061df8757e9f8f758e50439982908bb2f1 on exact main 1fa8ace2627bedf5d9aa77f8525de9bc76d25204. Trusted authorization gate and all required final-head CI are terminal-success.",
    "binding_mode": "EXACT_REVISION_BOUND"
  },
  "target": {
    "kind": "pull_request",
    "identifier": "https://github.com/martaxi-boss/Project-leader/pull/83",
    "revision": "5e2d6a061df8757e9f8f758e50439982908bb2f1",
    "base_revision": "1fa8ace2627bedf5d9aa77f8525de9bc76d25204",
    "environment": null
  }
}
